{
  "$schema": "https://rotiv.dev/spec/v1",
  "version": "1",
  "framework_version": "0.1.0",
  "project": {
    "name": "e2e-test-phase3",
    "created_at": "2026-03-13T04:39:42Z"
  },
  "routes": [],
  "models": [],
  "modules": [],
  "conventions": {
    "routes_dir": "app/routes",
    "models_dir": "app/models",
    "components_dir": "app/components"
  }
}
